speaker,date,start_time,duration,text
Vice President ...:,9/29/20,0:18:13,0:00:57,"Good luck. 200,000 dead. As you said, over seven million infected in the United States. We, in fact, have 4% of the world's population, 20% of the deaths. 40,000 people a day are contracting COVID. In addition to that, about between 750 and 1000 people a day are dying. When he was presented with that number, he said, ""It is what it is."" Well, it is what it is because you are who you are. That's why it is. The President has no plan. He hasn't laid out anything. He knew all the way back in February how serious this crisis was. He knew it was a deadly disease. What did he do? He's on tape as acknowledging he knew it. He said he didn't tell us or give people a warning of it because he didn't want to panic the American people. You don't panic. He panicked. In addition to that, what did he do?"
Vice President ...:,9/29/20,0:19:10,0:00:13,He went in and we were insisting that the people we had in the ground in China should be able to go to Wuhan and determine for themselves how dangerous this was. He did not even ask Xi to do that.
President Donal...:,9/29/20,0:19:23,0:00:00,Wrong.
Vice President ...:,9/29/20,0:19:23,0:00:14,He told us what a great job Xi was doing. He said we owe him debt of gratitude for being so transparent with us. And what did he do then? He then did nothing. He waited and waited and waited. He still doesn't have a plan.
President Donal...:,9/29/20,0:19:37,0:00:00,Wrong.
Chris Wallace:,9/29/20,0:19:37,0:00:00,"Sir, it's his two minutes."
President Donal...:,9/29/20,0:19:37,0:00:00,It's so wrong.
Vice President ...:,9/29/20,0:19:37,0:00:33,"I laid out back in March, exactly what we should be doing. And I laid out again in July, what we should be doing. We should be providing all the protective gear possible. We should be providing the money the House has passed in order to be able to go out and get people the help they need to keep their businesses open. Open schools cost a lot of money. You should get out of your bunker and get out of the sand trap in your golf course and go in the Oval Office and bring together the Democrats and Republicans and fund what needs to be done now to save lives."
President Donal...:,9/29/20,0:20:10,0:00:01,"So, if we would have listened to you."
Chris Wallace:,9/29/20,0:20:11,0:00:00,"Wait, wait. You have two minutes, sir."
President Donal...:,9/29/20,0:20:11,0:00:35,"If we would've listened to you, the country would have been left wide open, millions of people would have died, not 200,000. And one person is too much. It's China's fault. It should have never happened. They stopped it from going in, but it was China's fault. And, by the way, when you talk about numbers, you don't know how many people died in China. You don't know how many people died in Russia. You don't know how many people died in India. They don't exactly give you a straight count, just so you understand. But if you look at what we've done, I closed it and you said, ""He's xenophobic. He's a racist and he's xenophobic,"" because you didn't think I should have closed our country. Wait a minute."
Chris Wallace:,9/29/20,0:20:46,0:00:01,"Sir, it's his two minutes."
President Donal...:,9/29/20,0:20:47,0:00:47,"You didn't think we should have closed our country because you thought it was terrible. You wouldn't have closed it for another two months. By my doing it early, in fact, Dr. Fauci said, ""President Trump saved thousands of lives."" Many of your Democrat Governors said, ""President Trump did a phenomenal job."" We worked with the Governor. Oh really, go take a look. The Governors said I did a phenomenal job. Most of them said that. In fact, people that would not be necessarily on my side said that, ""President Trump did a phenomenal job."" We did. We got the gowns. We got the masks. We made the ventilators. You wouldn't have made ventilators. And now we're weeks away from a vaccine. We're doing therapeutics already. Fewer people are dying when they get sick. Far fewer people are dying. We've done a great job."
President Donal...:,9/29/20,0:21:34,0:00:21,"The only thing I haven't done a good job, and that's because of the fake news, no matter what you say to them, they give you a bad press on it. It's just fake news. They give you good press, they give me bad press because that's the way it is, unfortunately. But let me just say something. I don't care. I've gotten used to it. But I'll tell you, Joe, you could never have done the job that we did. You don't have it in your blood. You could've never done that, Joe."
Vice President ...:,9/29/20,0:21:55,0:00:03,I know how to do the job. I know how to get the job done.
President Donal...:,9/29/20,0:21:58,0:00:07,"Well, you didn't do very well in Swine Flu. H1-N1, you were a disaster. Your own Chief of Staff said you were a disaster."
Vice President ...:,9/29/20,0:22:05,0:00:02,"14,000 people died, not 200,000."
President Donal...:,9/29/20,0:22:07,0:00:05,"A far less lethal disease, by the way."
Chris Wallace:,9/29/20,0:22:12,0:00:01,"Sir, you made a point. Let him answer it."
Vice President ...:,9/29/20,0:22:13,0:00:24,"And there was no one ... We didn't shut down the economy. This is his economy he shut down. The reason it's shut down is because, look, you folks at home. How many of you got up this morning and had an empty chair at the kitchen table because someone died of COVID? How many of you are in a situation where you lost your mom or dad and you couldn't even speak to them, you had a nurse holding a phone up so you could in fact say goodbye?"
President Donal...:,9/29/20,0:22:37,0:00:06,"We would have lost far more people, far more people. You would have been months late. You're months behind me, Joe."
Vice President ...:,9/29/20,0:22:43,0:00:22,"His own CDC Director says we could lose as many as another 200,000 people between now and the end of the year. And he said, if we just wear a mask, we can save half those numbers. Just a mask. And by the way, in terms of the whole notion of a vaccine, we're for a vaccine, but I don't trust him at all. Nor do you. I know you don't. What we trust is a scientist."
President Donal...:,9/29/20,0:23:05,0:00:05,"You don't trust Johnson & Johnson, Pfizer?"
Chris Wallace:,9/29/20,0:23:10,0:00:45,"Okay, gentlemen, gentlemen. Let me move on to questions about the future because you both have touched on two of the questions I'm going to ask. Focusing on the future first, President Trump, you have repeatedly either contradicted or been at odds with some of your governments own top scientists. The week before last, the Head of the Centers for Disease Control, Dr. Redfield said it would be summer before the vaccine would become generally available to the public. You said that he was confused and mistaken. Those were your two words. But Dr. Slaoui, the head of your Operation Warp Speed, has said exactly the same thing. Are they both wrong?"
President Donal...:,9/29/20,0:23:55,0:00:07,"Well, I've spoken to the companies and we can have it a lot sooner. It's a very political thing because people like this would rather make it political than save lives."
Vice President ...:,9/29/20,0:24:02,0:00:01,God.
President Donal...:,9/29/20,0:24:03,0:00:15,"It is a very political thing. I've spoken to Pfizer, I've spoken to all of the people that you have to speak to, Moderna, Johnson & Johnson, and others. They can go faster than that by a lot. It's become very political because the left... Or I don't know if I call them left, I don't know what I call them."
Chris Wallace:,9/29/20,0:24:18,0:00:04,"So you're suggesting that the head of your Operation Warp Speed, Dr. Slaoui-"
President Donal...:,9/29/20,0:24:22,0:00:07,"I disagree with him. No, I disagree with both of them. And he didn't say that. He said it could be there, but it could also be much sooner. I had him in my office two days ago."
Chris Wallace:,9/29/20,0:24:29,0:00:04,"He talked about the summer, sir, before it's generally available, just like Dr. Redfield."
President Donal...:,9/29/20,0:24:33,0:00:06,Because he said it's a possibility that we'll have the answer before November 1st. It could also be after that.
Chris Wallace:,9/29/20,0:24:39,0:00:01,"I'm talking about when it's generally available, not-"
President Donal...:,9/29/20,0:24:40,0:00:11,"Well, we're going to deliver it right away. We have the military all set up. Logistically, they're all set up. We have our military that delivers soldiers and they can do 200,000 a day. They're going to be delivering-"
Vice President ...:,9/29/20,0:24:51,0:00:02,This is the same man who told you-
President Donal...:,9/29/20,0:24:53,0:00:01,It's all set up.
Vice President ...:,9/29/20,0:24:54,0:00:10,"... by Easter, this would be gone away. By the warm weather, it'd be gone. Miraculous, like a miracle. And by the way, maybe you could inject some bleach in your arm, and that would take care of it. This is the same man."
President Donal...:,9/29/20,0:25:04,0:00:04,"That was said sarcastically, and you know that. That was said sarcastically."
Vice President ...:,9/29/20,0:25:08,0:00:21,"So here's the deal. This man is talking about a vaccine. Every serious company is talking about maybe having a vaccine done by the end of the year, but the distribution of that vaccine will not occur until sometime beginning of the middle of next year to get it out, if we get the vaccine. And pray God we will. Pray God we will."
Chris Wallace:,9/29/20,0:25:29,0:00:01,"Mr. Vice President, I want to pick up-"
President Donal...:,9/29/20,0:25:30,0:00:01,You'll have the vaccine sooner than that.
Chris Wallace:,9/29/20,0:25:31,0:00:27,"I want to pick up on this question though. You say the public can trust the scientists, but they can't trust President Trump. In fact, you said that again tonight. Your running mate, Senator Harris, goes further, saying that public health experts quote, ""Will be muzzled, will be suppressed."" Given the fact that polls already show that people are concerned about the vaccine and are reluctant to take it, are you and your running mate, Senator Harris, contributing to that fear?"
Vice President ...:,9/29/20,0:25:58,0:00:07,No more than the question you just asked him. You pointed out he puts pressure and disagrees with his own scientists.
Chris Wallace:,9/29/20,0:26:05,0:00:01,But you're saying you can't-
Vice President ...:,9/29/20,0:26:06,0:00:00,Everybody knows-
Chris Wallace:,9/29/20,0:26:06,0:00:02,Or Senator Harris is saying you can't trust the scientist.
Vice President ...:,9/29/20,0:26:08,0:00:04,"Well, no, no. You can trust the scientist. She didn't say that. You can trust the-"
Chris Wallace:,9/29/20,0:26:12,0:00:04,"She said that public health experts quote, ""Will be muzzled, will be suppressed."""
Vice President ...:,9/29/20,0:26:16,0:00:15,"Yes. Well, that's what he's going to try to do, but there's thousands of scientists out there, like here at this great hospital that don't work for him. Their job doesn't depend on him. They're the people... And by the way-"
President Donal...:,9/29/20,0:26:31,0:00:02,We spoke to the scientists that are in charge-
Vice President ...:,9/29/20,0:26:33,0:00:00,By the way-
President Donal...:,9/29/20,0:26:33,0:00:02,... they will have the vaccine very soon.
Chris Wallace:,9/29/20,0:26:35,0:00:00,Let him finish.
Vice President ...:,9/29/20,0:26:35,0:00:32,"Do you believe for a moment what he's telling you in light of all the lies he's told you about the whole issue relating to COVID? He still hasn't even acknowledged that he knew this was happening, knew how dangerous it was going to be back in February, and he didn't even tell you. He's on record as saying it. He panicked or he just looked at the stock market. One of the two. Because guess what? A lot of people died and a lot more are going to die unless he gets a lot smarter, a lot quicker-"
Chris Wallace:,9/29/20,0:27:07,0:00:01,Mr. President?
President Donal...:,9/29/20,0:27:08,0:00:16,"Did you use the word smart? So you said you went to Delaware State, but you forgot the name of your college. You didn't go to Delaware State. You graduated either the lowest or almost the lowest in your class. Don't ever use the word smart with me. Don't ever use that word."
Vice President ...:,9/29/20,0:27:24,0:00:00,"Oh, give me a break."
President Donal...:,9/29/20,0:27:24,0:00:05,"Because you know what? There's nothing smart about you, Joe. 47 years you've done nothing."
Vice President ...:,9/29/20,0:27:29,0:00:02,"Well, let's have this debate-"
President Donal...:,9/29/20,0:27:31,0:00:11,"Let me just tell you something, Joe. If you would have had the charge of what I was put through, I had to close the greatest economy of the history of our country. And by the way, now it's being built again and it's going up fast."
Chris Wallace:,9/29/20,0:27:42,0:00:02,"We'll get to the economy in the next segment, sir."
President Donal...:,9/29/20,0:27:44,0:00:02,Okay. It's going up fast. I look forward to talking about it.
Chris Wallace:,9/29/20,0:27:46,0:00:25,"Okay. When it comes to how the virus has been handled so far, the two of you have taken very different approaches, and this is going to affect how the virus is handled going forward by whichever of you ends up becoming the next president. I want to quickly go through several of those. Reopenings. Vice President Biden, you have been much more reluctant than President Trump about reopening the economy and schools. Why, sir?"
Vice President ...:,9/29/20,0:28:11,0:00:14,"Because he doesn't have a plan. If I were running it, I'd know what the plan is. You've got to provide these businesses the ability to have the money to be able to reopen with the PPE, as well as with the sanitation they need. You have to provide them classic-"
President Donal...:,9/29/20,0:28:25,0:00:02,Tell that to Nancy Pelosi.
Vice President ...:,9/29/20,0:28:27,0:00:02,Will he just shush for a minute?
President Donal...:,9/29/20,0:28:29,0:00:03,"Tell that to Nancy Pelosi, and Schumer [crosstalk 00:04:52] Chuck."
Vice President ...:,9/29/20,0:28:32,0:00:12,"Nancy Pelosi and Schumer, they have a plan. He won't even meet with them. The Republicans won't meet in the Senate. He sits in his golf course. Well, I mean, literally, think about it. Think about it."
President Donal...:,9/29/20,0:28:44,0:00:02,"You probably play more than I do, Joe."
Chris Wallace:,9/29/20,0:28:46,0:00:02,What about this question of reopenings and the fact-
President Donal...:,9/29/20,0:28:48,0:00:07,"Well, he wants to shut down this country and I want to keep it open, and we did a great thing by shutting it down-"
Vice President ...:,9/29/20,0:28:55,0:00:00,You just admitted you'd shut it down.
President Donal...:,9/29/20,0:28:55,0:00:39,"Wait a minute, Joe. Let me shut you down for a second, Joe, just for one second. He wants to shut down the country. We just went through it. We had to, because we didn't know anything about the disease. Now we've found that elderly people with heart problems and diabetes and different problems are very, very vulnerable. We learned a lot. Young children aren't, even younger people aren't. We've learned a lot, but he wants to shut it down. More people will be hurt by continuing. If you look at Pennsylvania, if you look at certain states that have been shut down, they have Democrat governors, all, one of the reasons they shut down is because they want to keep it shut down until after the election on November 3rd."
Chris Wallace:,9/29/20,0:29:34,0:00:01,All right. I want to move onto another-
President Donal...:,9/29/20,0:29:35,0:00:00,Because it's a political thing.
Chris Wallace:,9/29/20,0:29:35,0:00:00,I want to move onto another subject.
Vice President ...:,9/29/20,0:29:35,0:00:00,I got to respond to that.
Chris Wallace:,9/29/20,0:29:35,0:00:02,I want to move-
President Donal...:,9/29/20,0:29:37,0:00:01,But those states-
Chris Wallace:,9/29/20,0:29:38,0:00:02,"Gentlemen, I want to move onto another subject."
President Donal...:,9/29/20,0:29:40,0:00:02,Those states are not doing well that are shut down right now.
Vice President ...:,9/29/20,0:29:42,0:00:02,I got to respond to that.
President Donal...:,9/29/20,0:29:44,0:00:00,He wants to shut down the whole country.
Chris Wallace:,9/29/20,0:29:44,0:00:16,"President Trump, you have begun to increasingly question the effectiveness of masks as a disease preventer. And in fact, recently you have cited the issue of waiters touching their masks and touching plates. Are you questioning the efficacy of masks?"
President Donal...:,9/29/20,0:30:00,0:00:13,"No, I think masks are okay. You have to understand, if you look... I mean, I have a mask right here. I put a mask on when I think I need it. Tonight, as an example, everybody's had a test and you've had social distancing and all of the things that you have to, but I wear masks-"
Vice President ...:,9/29/20,0:30:13,0:00:00,Just like your rally.
President Donal...:,9/29/20,0:30:13,0:00:02,"... when needed. When needed, I wear masks."
Chris Wallace:,9/29/20,0:30:15,0:00:01,Okay. Let me ask-
President Donal...:,9/29/20,0:30:16,0:00:09,"I don't wear a mask like him. Every time you see him, he's got a mask. He could be speaking 200 feet away from him and he shows up with the biggest mask I've ever seen. I will say this-"
Chris Wallace:,9/29/20,0:30:25,0:00:03,"Vice President Biden, go ahead, sir."
Vice President ...:,9/29/20,0:30:28,0:00:07,"Look, the way to open businesses is give them the wherewithal to be able open. We provided money, the-"
Chris Wallace:,9/29/20,0:30:35,0:00:01,"But I was asking you, sir, about masks."
Vice President ...:,9/29/20,0:30:36,0:00:14,"Well, masks make a big difference. His own head of the CDC said if we just wore masks between now, if everybody wore a mask and social distanced between now and January, we'd probably save up to 100,000 lives. It matters. It matters."
President Donal...:,9/29/20,0:30:50,0:00:02,And they've also said the opposite. They've also said-
Vice President ...:,9/29/20,0:30:52,0:00:02,No serious person has said the opposite. No serious person.
Chris Wallace:,9/29/20,0:30:54,0:00:03,Okay. I want to ask you-
President Donal...:,9/29/20,0:30:57,0:00:01,Dr. Fauci. Dr. Fauci said the opposite.
Vice President ...:,9/29/20,0:30:58,0:00:01,He did not say the opposite.
Chris Wallace:,9/29/20,0:30:59,0:00:03,"I want to ask you, we've got a little than a minute left in this segment."
President Donal...:,9/29/20,0:31:02,0:00:03,"He said very strongly, ""Masks are not good."" Then he changed his mind. He said, ""Masks are good."""
Chris Wallace:,9/29/20,0:31:05,0:00:00,I want to ask-
President Donal...:,9/29/20,0:31:05,0:00:02,I'm okay with masks. I'm not fighting masks.
Chris Wallace:,9/29/20,0:31:07,0:00:11,"I want to ask you both about one last subject because your different approaches has even affected the way that you have campaigned. President Trump, you're holding large rallies with crowds packed together, thousands of people."
President Donal...:,9/29/20,0:31:18,0:00:01,Outside.
Chris Wallace:,9/29/20,0:31:19,0:00:07,"Outside. Yes, sir. Agreed. Vice President Biden, you are holding much smaller events with-"
President Donal...:,9/29/20,0:31:26,0:00:01,Because nobody will show up.
Chris Wallace:,9/29/20,0:31:27,0:00:00,... people with masks.
President Donal...:,9/29/20,0:31:27,0:00:03,"Well, it's true. Nobody shows up to his rallies."
Chris Wallace:,9/29/20,0:31:30,0:00:06,"All right. In any case, why you holding the big rallies? Why you not? You go first, sir."
President Donal...:,9/29/20,0:31:36,0:00:03,Because people want to hear what I have to say. I mean-
Chris Wallace:,9/29/20,0:31:39,0:00:02,But are not worried about us spreading disease?
President Donal...:,9/29/20,0:31:41,0:00:05,"... I'm doing my job as a president, and I'll have 25, 35,000 people show up at airports. We use airports and hangers and we have a lot of people-"
Chris Wallace:,9/29/20,0:31:46,0:00:02,"Are you not worried about the disease issues, sir?"
President Donal...:,9/29/20,0:31:48,0:00:18,"Well, so far we have had no problem whatsoever. It's outside. That's a big difference according to the experts. We do them outside, we have tremendous crowds, as you see, and literally on 24 hours notice. And Joe does the circles and has three people someplace."
Vice President ...:,9/29/20,0:32:06,0:00:22,"By the way, did you see one of the last big rallies he had? A reporter came up to him to ask him a question, he said, ""No, no, no. Stand back, put on your mask, put on a mask. Have you been tested? I'm way far away from those other people."" That's what he said, ""I'm going to be okay."" He's not worried about you. He's not worried about the people out there [crosstalk 00:08:48]."
President Donal...:,9/29/20,0:32:28,0:00:01,We've had no negative effect.
Vice President ...:,9/29/20,0:32:29,0:00:02,No negative effect. Come on.
President Donal...:,9/29/20,0:32:31,0:00:04,"We've had no negative effect, and we've had 35, 40,000 people at these rallies."
Chris Wallace:,9/29/20,0:32:35,0:00:02,All right. Do you want to just quickly finish up? Because I want to move on to our next-
Vice President ...:,9/29/20,0:32:37,0:00:11,"Yes, I would. He's been totally irresponsible the way in which he has handled the social distancing and people wearing masks, basically encouraged them not to. He's a fool on this."
President Donal...:,9/29/20,0:32:48,0:00:04,"If you could get the crowds, you would have done the same thing. But you can't. Nobody cares."
Chris Wallace:,9/29/20,0:32:52,0:00:01,"Gentlemen, can we move on to the-"
President Donal...:,9/29/20,0:32:53,0:00:00,No cares.
Chris Wallace:,9/29/20,0:32:53,0:00:02,"Gentlemen, can we move on to the economy?"
President Donal...:,9/29/20,0:32:55,0:00:00,Yes.
Chris Wallace:,9/29/20,0:32:55,0:00:07,"The economy is, I think it's fair to say, recovering faster than expected from the shutdown-"
President Donal...:,9/29/20,0:33:02,0:00:00,Much faster.
Chris Wallace:,9/29/20,0:33:02,0:00:30,"... in the second quarter. The unemployment rate fell to 8.4% last month. The Federal Reserve says the hit to growth, which is going to be there, is not going to be nearly as big as they had expected. President Trump, you say we are in a V-shaped recovery. Vice President Biden, you say it's more of a K-shape. What difference does that mean to the American people in terms of the economy? President Trump, in this segment you go first."
President Donal...:,9/29/20,0:33:32,0:00:39,"So we built the greatest economy in history. We closed it down because of the China plague. When the plague came in, we closed it down, which was very hard psychologically to do. He didn't think we should close it down and he was wrong. Again, two million people would be dead now instead of... Still, 204,000 people is too much. One person is too much. Should have never happened from China. But what happened is we closed it down and now we're reopening and we're doing record business. We had 10.4 million people in a four month period that we've put back into the workforce. That's a record the likes of which nobody's ever seen before. And he wants to close down the... He will shut it down again. He will destroy this country."
President Donal...:,9/29/20,0:34:11,0:00:33,"A lot of people, between drugs and alcohol and depression, when you start shutting it down, you take a look at what's happening at some of your Democrat-run states where they have these tough shutdowns. And I'm telling you it's because they don't want to open it. One of them came out last week, you saw that, ""Oh, we're going to open up on November 9th."" Why November 9th? Because it's after the election. They think they're hurting us by keeping them closed. They're hurting people. People know what to do. They can social distance. They can wash their hands, they can wear masks. They can do whatever they want, but they got to open these states up."
President Donal...:,9/29/20,0:34:44,0:00:32,"When you look at North Carolina, when you look, and these governors are under siege, Pennsylvania, Michigan, and a couple of others, you got to open these states up. It's not fair. You're talking about almost it's like being in prison. And you look at what's going on with divorce, look at what's going on with alcoholism and drugs. It's a very, very sad thing. And he'll close down the whole country. This guy will close down the whole country and destroy our country. Our country is coming back incredibly well, setting records as it does it. We don't need somebody to come in and say, ""Let's shut it down."""
Chris Wallace:,9/29/20,0:35:16,0:00:12,"All right. Your two minutes, sir. We're now moved to you. As I said, posing the question, the president says it's a V-shape recovery, you say it's a K-shaped recovery. What's the difference?"
Vice President ...:,9/29/20,0:35:28,0:00:29,"The difference is millionaires and billionaires like him in the middle of the COVID crisis have done very well. Billionaires have made another $300 billion because of his profligate tax proposal, and he only focused on the market. But you folks at home, you folks living in Scranton and Claymont and all the small towns and working class towns in America, how well are you doing? This guy paid a total of $750 in taxes."
President Donal...:,9/29/20,0:35:57,0:00:01,That's wrong.
Chris Wallace:,9/29/20,0:35:58,0:00:00,"Sir, wait. No. Sir-"
President Donal...:,9/29/20,0:35:58,0:00:02,[crosstalk 00:12:19].
Chris Wallace:,9/29/20,0:36:00,0:00:03,"Yeah, I understand. You've agreed to the two minutes, so please let him have it."
