speaker,date,start_time,duration,text
Chris Wallace:,9/29/20,0:00:00,0:00:50,"Good evening from the Health Education Campus of Case Western Reserve University and the Cleveland Clinic. I'm Chris Wallace of Fox News and I welcome you to the first of the 2020 Presidential Debates between President Donald J. Trump and former Vice President Joe Biden. This debate is sponsored by the Commission on Presidential debates. The Commission has designed the format, six roughly 15 minute segments with two minute answers from each candidate to the first question, then open discussion for the rest of each segment. Both campaigns have agreed to these rules. For the record, I decided the topics and the questions in each topic. I can assure you none of the questions has been shared with the Commission or the two candidates."
Chris Wallace:,9/29/20,0:00:50,0:00:39,"This debate is being conducted under health and safety protocols designed by the Cleveland Clinic, which is serving as the Health Security advisor to the Commission for all four debates. As a precaution, both campaigns have agreed the candidates will not shake hands at the beginning of tonight's debate. The audience here in the hall has promised to remain silent. No cheers, no boos, or other interruptions so we, and more importantly you, can focus on what the candidates have to say. No noise except right now, as we welcome the Republican nominee, President Trump, and the Democratic nominee Vice President Biden."
Vice President ...:,9/29/20,0:01:29,0:00:02,"How you doing, man?"
President Donal...:,9/29/20,0:01:31,0:00:00,How are you doing?
Vice President ...:,9/29/20,0:01:31,0:00:20,I'm well.
Chris Wallace:,9/29/20,0:01:51,0:00:50,"Gentlemen, a lot of people been waiting for this night, so let's get going. Our first subject is the Supreme Court. President Trump, you nominated Amy Coney Barrett over the weekend to succeed the late Ruth Bader Ginsburg on the Court. You say the Constitution is clear about your obligation and the Senate's to consider a nominee to the Court. Vice President Biden, you say that this is an effort by the President and Republicans to jam through on an appointment in what you call an abuse of power. My first question to both of you tonight, why are you right in the argument you make and your opponent wrong? And where do you think a Justice Barrett would take the court? President Trump, in this first segment, you go first. Two minutes."
President Donal...:,9/29/20,0:02:41,0:00:52,"Thank you very much, Chris. I will tell you very simply. We won the election. Elections have consequences. We have the Senate, we have the White House, and we have a phenomenal nominee respected by all. Top, top academic, good in every way. Good in every way. In fact, some of her biggest endorsers are very liberal people from Notre Dame and other places. So I think she's going to be fantastic. We have plenty of time. Even if we did it after the election itself. I have a lot of time after the election, as you know. So I think that she will be outstanding. She's going to be as good as anybody that has served on that court. We really feel that. We have a professor at Notre Dame, highly respected by all, said she's the single greatest student he's ever had. He's been a professor for a long time at a great school."
President Donal...:,9/29/20,0:03:33,0:00:29,"And we won the election and therefore we have the right to choose her, and very few people knowingly would say otherwise. And by the way, the Democrats, they wouldn't even think about not doing it. The only difference is they'd try and do it faster. There's no way they would give it up. They had Merrick Garland, but the problem is they didn't have the election so they were stopped. And probably that would happen in reverse, also. Definitely would happen in reverse. So we won the election and we have the right to do it, Chris."
Chris Wallace:,9/29/20,0:04:02,0:00:07,"President Trump, thank you. Same question to you, Vice President Biden. You have two minutes."
Vice President ...:,9/29/20,0:04:09,0:00:05,"Well, first of all, thank you for doing this and looking forward to this, Mr. President."
President Donal...:,9/29/20,0:04:14,0:00:02,"Thank you, Joe."
Vice President ...:,9/29/20,0:04:16,0:00:36,The American people have a right to have a say in who the Supreme Court nominee is and that say occurs when they vote for United States Senators and when they vote for the President of United States. They're not going to get that chance now because we're in the middle of an election already. The election has already started. Tens of thousands of people already voted and so the thing that should happen is we should wait. We should wait and see what the outcome of this election is because that's the only way the American people get to express their view is by who they elect as President and who they elect as Vice President.
Vice President ...:,9/29/20,0:04:52,0:00:56,"Now, what's at stake here is the President's made it clear, he wants to get rid of the Affordable Care Act. He's been running on that, he ran on that and he's been governing on that. He's in the Supreme Court right now trying to get rid of the Affordable Care Act, which will strip 20 million people from having health insurance now, if it goes into court. And the justice, I'm not opposed to the justice, she seems like a very fine person. But she's written, before she went in the bench, which is her right, that she thinks that the Affordable Care Act is not Constitutional. The other thing that's on the court, and if it's struck down, what happens? Women's rights are fundamentally changed. Once again, a woman could pay more money because she has a pre-existing condition of pregnancy. They're able to charge women more for the same exact procedure a man gets."
Vice President ...:,9/29/20,0:05:48,0:00:26,"And that ended when we, in fact, passed the Affordable Care Act, and there's a hundred million people who have pre-existing conditions and they'll be taken away as well. Those pre-existing conditions, insurance companies are going to love this. And so it's just not appropriate to do this before this election. If he wins the election and the Senate is Republican, then he goes forward. If not, we should wait until February."
President Donal...:,9/29/20,0:06:14,0:00:27,"There aren't a hundred million people with pre-existing conditions. As far as a say is concerned, the people already had their say. Okay, Justice Ginsburg said very powerfully, very strongly, at some point 10 years ago or so, she said a President and the Senate is elected for a period of time, but a President is elected for four years. We're not elected for three years. I'm not elected for three years. So we have the Senate, we have a President-"
Vice President ...:,9/29/20,0:06:41,0:00:01,He's elected to the next election.
President Donal...:,9/29/20,0:06:42,0:00:22,"During that period of time, during that period of time, we have an opening. I'm not elected for three years. I'm elected for four years. Joe, the hundred million people is totally wrong. I don't know where you got that number. The bigger problem that you have is that you're going to extinguish 180 million people with their private health care, that they're very happy this."
Vice President ...:,9/29/20,0:07:04,0:00:01,That's simply not true.
President Donal...:,9/29/20,0:07:05,0:00:04,"Well, you're certainly going to socialist. You're going to socialist-"
Chris Wallace:,9/29/20,0:07:09,0:00:02,"Gentlemen, we're now into open discussion."
Vice President ...:,9/29/20,0:07:11,0:00:01,Open discussion.
Chris Wallace:,9/29/20,0:07:12,0:00:01,"Open discussion, yes, I agree. Go ahead, Vice President."
Vice President ...:,9/29/20,0:07:13,0:00:25,"Number one, he knows what I proposed. What I proposed is that we expand Obamacare and we increase it. We do not wipe any. And one of the big debates we had with 23 of my colleagues trying to win the nomination that I won, were saying that Biden wanted to allow people to have private insurance still. They can. They do. They will under my proposal."
President Donal...:,9/29/20,0:07:38,0:00:02,That's not what you've said and it's not what your party is saying.
Vice President ...:,9/29/20,0:07:40,0:00:02,That is simply a lie.
President Donal...:,9/29/20,0:07:42,0:00:03,Your party doesn't say it. Your party wants to go socialist medicine and socialist healthcare.
Vice President ...:,9/29/20,0:07:45,0:00:03,"The party is me. Right now, I am the Democratic Party."
President Donal...:,9/29/20,0:07:48,0:00:01,"And they're going to dominate you, Joe. You know that."
Vice President ...:,9/29/20,0:07:49,0:00:02,I am the Democratic Party right now.
President Donal...:,9/29/20,0:07:51,0:00:01,Not according to Harris.
Vice President ...:,9/29/20,0:07:52,0:00:27,"The platform of the Democratic Party is what I, in fact, approved of, what I approved of. Now, here's the deal. The deal is that it's going to wipe out pre-existing conditions. And, by the way, the 200,000 people that have died on his watch, how many of those have survived? Well, there's seven million people that contracted COVID. What does it mean for them going forward if you strike down the Affordable Care Act?"
President Donal...:,9/29/20,0:08:19,0:00:08,"Joe, you've had 308,000 military people dying because you couldn't provide them proper healthcare in the military. So don't tell me about this."
Vice President ...:,9/29/20,0:08:27,0:00:01,I'm happy to talk about this.
President Donal...:,9/29/20,0:08:28,0:00:10,"And if you were here, it wouldn't be 200, it would be two million people because you were very late on the draw. You didn't want me to ban China, which was heavily infected. You didn't want me to ban Europe."
Chris Wallace:,9/29/20,0:08:38,0:00:02,"All right, gentlemen, Mr. President."
President Donal...:,9/29/20,0:08:40,0:00:04,"You would have been much later, Joe, much later."
Chris Wallace:,9/29/20,0:08:44,0:00:00,Mr. President.
President Donal...:,9/29/20,0:08:44,0:00:01,We're talking about two million people.
Vice President ...:,9/29/20,0:08:45,0:00:01,You're not going to be able to shut him up.
Chris Wallace:,9/29/20,0:08:46,0:00:05,"Mr. President, as the moderator, we are going to talk about COVID in the next segment. But go ahead."
Vice President ...:,9/29/20,0:08:51,0:00:14,"Let me finish. The point is that the President also is opposed to Roe V. Wade. That's on the ballot as well and the court, in the court, and so that's also at stake right now. And so the election is all-"
President Donal...:,9/29/20,0:09:05,0:00:06,You don't know what's on the ballot. Why is it on the ballot? Why is it on the ballot? It's not on the ballot.
Vice President ...:,9/29/20,0:09:11,0:00:01,It's on the ballot in the court.
President Donal...:,9/29/20,0:09:12,0:00:01,I don't think so.
Vice President ...:,9/29/20,0:09:13,0:00:01,In the court.
President Donal...:,9/29/20,0:09:14,0:00:01,There's nothing happening there.
Vice President ...:,9/29/20,0:09:15,0:00:01,Donald would you just be quiet for a minute.
President Donal...:,9/29/20,0:09:16,0:00:04,You don't know her view on Roe V. Wade? You don't know here view.
Chris Wallace:,9/29/20,0:09:20,0:00:11,"Well, all right. All right. Let's talk. We've got a lot to unpack here, gentlemen. We've got a lot of time. On healthcare, and then we'll come back to Roe V. Wade."
Vice President ...:,9/29/20,0:09:31,0:00:00,All right.
Chris Wallace:,9/29/20,0:09:31,0:00:14,"Mr. President, the Supreme Court will hear a case a week after the election in which the Trump Administration, along with 18 state Attorney Generals are seeking to overturn Obamacare, to end Obamacare."
President Donal...:,9/29/20,0:09:45,0:00:00,That's right.
Chris Wallace:,9/29/20,0:09:45,0:00:02,You have spent the last week-
President Donal...:,9/29/20,0:09:47,0:00:01,Because they want to give good healthcare.
Chris Wallace:,9/29/20,0:09:48,0:00:03,"If I may ask my question, sir."
Vice President ...:,9/29/20,0:09:51,0:00:00,Good healthcare.
Chris Wallace:,9/29/20,0:09:51,0:00:14,"Over the last four years, you have promised to repeal and replace Obamacare, but you have never in these four years come up with a plan, a comprehensive plan, to replace Obamacare."
President Donal...:,9/29/20,0:10:05,0:00:01,"Yes, I have. Of course, I have. The individual mandate."
Chris Wallace:,9/29/20,0:10:06,0:00:02,[crosstalk 00:11:26] when I finish I'm going to give an opportunity-
President Donal...:,9/29/20,0:10:08,0:00:03,"Excuse me. I got rid of the individual mandate, which was a big chunk of Obamacare."
Chris Wallace:,9/29/20,0:10:11,0:00:01,That's not a comprehensive place.
President Donal...:,9/29/20,0:10:12,0:00:03,That is absolutely a big thing. That was the worst part of Obamacare.
Chris Wallace:,9/29/20,0:10:15,0:00:01,"I didn't ask, sir."
President Donal...:,9/29/20,0:10:16,0:00:02,"Chris, that was the worst part of Obamacare."
Chris Wallace:,9/29/20,0:10:18,0:00:00,You're debating him not me. Let me ask my question.
President Donal...:,9/29/20,0:10:18,0:00:06,"Well, I'll ask Joe. The individual mandate was the most unpopular aspect of Obamacare."
Chris Wallace:,9/29/20,0:10:24,0:00:00,Mr. President.
President Donal...:,9/29/20,0:10:24,0:00:02,I got rid of it. And we will protect people.
Chris Wallace:,9/29/20,0:10:26,0:00:06,"Mr. President, I'm the moderator of this debate and I would like you to let me ask my question and then you can answer."
President Donal...:,9/29/20,0:10:32,0:00:01,Go ahead.
Chris Wallace:,9/29/20,0:10:33,0:00:23,"You, in the course of these four years, have never come up with a comprehensive plan to replace Obamacare, and just this last Thursday you signed a largely symbolic Executive Order to protect people with pre-existing conditions five days before this debate. So my question, sir, is what is the Trump healthcare plan?"
President Donal...:,9/29/20,0:10:56,0:00:24,"Well, first of all, I guess I'm debating you, not him, but that's okay. I'm not surprised. Let me just tell you something. There's nothing symbolic. I'm cutting drug prices. I'm going with Favored Nations, which no President has the courage to do because you're going against big pharma. Drug prices will be coming down 80 or 90%. You could have done it during your 47 year period in government, but you didn't do it. Nobody's done it. So we're cutting healthcare."
Chris Wallace:,9/29/20,0:11:20,0:00:00,What about pre-existing conditions?
President Donal...:,9/29/20,0:11:20,0:00:01,All of the things that we've done.
Vice President ...:,9/29/20,0:11:21,0:00:01,He has not done healthcare.
President Donal...:,9/29/20,0:11:22,0:00:21,"I'll give you an example. Insulin, it was destroying families, destroying people, the cost. I'm getting it for so cheap it's like water, you want to know the truth. So cheap. Take a look at all of the drugs that what we're doing. Prescription drug prices, we're going to allow our Governors now to go to other countries to buy drugs because when they paid just a tiny fraction of what we do."
Chris Wallace:,9/29/20,0:11:43,0:00:01,"Okay, like I say, this is open discussion."
President Donal...:,9/29/20,0:11:44,0:00:02,This is big stuff.
Chris Wallace:,9/29/20,0:11:46,0:00:11,"Sir, you'll be happy. I'm about to pick up on one of your points to ask the Vice President, which is, he points out that you would like to add a public option to Obamacare."
Vice President ...:,9/29/20,0:11:57,0:00:00,Yes.
Chris Wallace:,9/29/20,0:11:57,0:00:06,And the argument that he makes and other Republicans make is that that is going to end private insurance.
Vice President ...:,9/29/20,0:12:03,0:00:02,It is not.
Chris Wallace:,9/29/20,0:12:05,0:00:01,If I start asking the question.
President Donal...:,9/29/20,0:12:06,0:00:03,"That's not what your party says, by the way."
Chris Wallace:,9/29/20,0:12:09,0:00:03,And it will end private insurance and create a government takeover of health.
Vice President ...:,9/29/20,0:12:12,0:00:25,"It does not. It's only for those people who are so poor they qualify for Medicaid they can get that free in most States, except Governors who want to deny people who are poor Medicaid. Anyone who qualifies for Medicaid would automatically be enrolled in the public option. The vast majority of the American people would still not be in that option. Number one. Number two."
President Donal...:,9/29/20,0:12:37,0:00:07,"Joe, you agreed with Bernie Sanders, who's far left, on the manifesto, we call it. And that gives you socialized medicine."
Vice President ...:,9/29/20,0:12:44,0:00:01,"Look, hey."
President Donal...:,9/29/20,0:12:45,0:00:01,Are you saying you didn't agree?
Vice President ...:,9/29/20,0:12:46,0:00:04,I'm not going to listen to him. The fact of the matter is I beat Bernie Sanders.
President Donal...:,9/29/20,0:12:50,0:00:00,Not by much.
Vice President ...:,9/29/20,0:12:50,0:00:02,I beat him by a whole hell of a lot.
President Donal...:,9/29/20,0:12:52,0:00:00,Not by much.
Vice President ...:,9/29/20,0:12:52,0:00:02,"I'm here standing facing you, old buddy."
President Donal...:,9/29/20,0:12:54,0:00:03,If Pocahontas would have left two days early you would have lost every primary.
Vice President ...:,9/29/20,0:12:57,0:00:01,All he knows how to do-
President Donal...:,9/29/20,0:12:58,0:00:03,"On Super Tuesday, you got very lucky."
Vice President ...:,9/29/20,0:13:01,0:00:02,Look he's the deal. I got very lucky. I'm going to get very lucky tonight as well.
President Donal...:,9/29/20,0:13:03,0:00:00,With what?
Vice President ...:,9/29/20,0:13:03,0:00:02,And tonight I'm going to make sure.
President Donal...:,9/29/20,0:13:05,0:00:00,With what?
Vice President ...:,9/29/20,0:13:05,0:00:09,"Because here's the deal, here's the deal. The fact is that everything he's saying so far is simply a lie. I'm not here to call out his lies. Everybody knows he's a liar."
President Donal...:,9/29/20,0:13:14,0:00:07,"But you agree. Joe, you're the liar. You graduated last in your class not first in your class."
Vice President ...:,9/29/20,0:13:21,0:00:02,"God, I want to make sure-"
Chris Wallace:,9/29/20,0:13:23,0:00:01,"Mr. President, can you let him finish, sir?"
Vice President ...:,9/29/20,0:13:24,0:00:02,"No, he doesn't know how to do that."
President Donal...:,9/29/20,0:13:26,0:00:01,"You'd be surprised. You'd be surprised. Go ahead, Joe."
Vice President ...:,9/29/20,0:13:27,0:00:04,"The wrong guy, the wrong night, at the wrong time."
President Donal...:,9/29/20,0:13:31,0:00:04,"Listen, you agreed with Bernie Sanders and the manifesto."
Vice President ...:,9/29/20,0:13:35,0:00:02,"There is no manifesto, number one."
Chris Wallace:,9/29/20,0:13:37,0:00:01,"Please let him speak, Mr. President."
Vice President ...:,9/29/20,0:13:38,0:00:00,Number two.
President Donal...:,9/29/20,0:13:38,0:00:01,He just lost the left.
Vice President ...:,9/29/20,0:13:39,0:00:02,Number two.
President Donal...:,9/29/20,0:13:41,0:00:12,"You just lost the left. You agreed with Bernie Sanders on a plan that you absolutely agreed to and under that plan [crosstalk 00:15:10], they call it socialized medicine."
Chris Wallace:,9/29/20,0:13:53,0:00:01,Mr. President.
Vice President ...:,9/29/20,0:13:54,0:00:06,"I'll tell you what, he is not for any help for people needing healthcare."
President Donal...:,9/29/20,0:14:00,0:00:01,"Who is, Bernie?"
Vice President ...:,9/29/20,0:14:01,0:00:20,"Because he, in fact, already has costs 10 million people their healthcare that they had from their employers because of his recession. Number one. Number two, there are 20 million people getting healthcare through Obamacare now that he wants to take it away. He won't ever look you in the eye and say that's what he wants to do. Take it away."
President Donal...:,9/29/20,0:14:21,0:00:04,"No, I want to give them better healthcare at a much lower price, because Obamacare is no good."
Vice President ...:,9/29/20,0:14:25,0:00:01,He doesn't know how. He doesn't know how to do that.
President Donal...:,9/29/20,0:14:26,0:00:01,I've already fixed it.
Vice President ...:,9/29/20,0:14:27,0:00:02,He has never offered a plan.
President Donal...:,9/29/20,0:14:29,0:00:05,"We've already fixed it to an extent. Obamacare, as you might know but probably don't, Obamacare is no good."
Chris Wallace:,9/29/20,0:14:34,0:00:05,"Gentlemen, you realize if you're both speaking at the same time. Let the President. Go ahead, sir."
President Donal...:,9/29/20,0:14:39,0:00:43,"Obamacare is no good. We made it better and I had a choice to make very early on. We took away the individual mandate. We guaranteed pre-existing conditions, but took away the individual mandate. Listen, this is the way it is. And that destroyed ... They shouldn't even call it Obamacare, then I had a choice to make, do I let my people run it really well or badly? If I run it badly, they'll probably blame him, but they'll blame me. But more importantly, I want to help people. Okay. I said, ""You've got to run it so well."" And I just had a meeting with them. They said the problem is, no matter how well you run Obamacare, it's a disaster. It's too expensive. Premiums are too high, that it doesn't work. So we do want to get rid of it. Chris, we want to get rid of that and give something that's cheaper and better."
Chris Wallace:,9/29/20,0:15:22,0:00:03,"I understand that, sir. But I have to give you roughly equal time."
President Donal...:,9/29/20,0:15:25,0:00:00,Go ahead.
Chris Wallace:,9/29/20,0:15:25,0:00:02,"Please let the Vice President talk, sir."
President Donal...:,9/29/20,0:15:27,0:00:01,Good.
Vice President ...:,9/29/20,0:15:28,0:00:02,He has no plan for healthcare.
President Donal...:,9/29/20,0:15:30,0:00:02,"Of course, we do."
Chris Wallace:,9/29/20,0:15:32,0:00:00,Please.
Vice President ...:,9/29/20,0:15:32,0:00:21,"He sends out wishful thinking. He has Executive Orders that have no power. He hasn't lowered drug costs for anybody. He's been promising a healthcare plan since he got elected. He has none, like almost everything else he talks about. He does not have a plan. He doesn't have a plan. And the fact is this man doesn't know what he's talking about. [crosstalk 00:17:14]."
Chris Wallace:,9/29/20,0:15:53,0:00:02,"All right, I have one final question for you."
Vice President ...:,9/29/20,0:15:55,0:00:01,Sure.
Chris Wallace:,9/29/20,0:15:56,0:00:39,"Mr. Vice President, if Senate Republicans, we were talking originally about the Supreme Court here, if Senate Republicans go ahead and confirm Justice Barrett there has been talk about ending the filibuster or even packing the court, adding to the nine justices there. You call this a distraction by the President. But, in fact, it wasn't brought up by the President. It was brought up by some of your Democratic colleagues in the Congress. So my question to you is, you have refused in the past to talk about it, are you willing to tell the American tonight whether or not you will support either ending the filibuster or packing the court?"
Vice President ...:,9/29/20,0:16:35,0:00:10,"Whatever position I take on that, that'll become the issue. The issue is the American people should speak. You should go out and vote. You're voting now. Vote and let your Senators know strongly how you feel."
President Donal...:,9/29/20,0:16:45,0:00:02,Are you going to pack the court?
Vice President ...:,9/29/20,0:16:47,0:00:01,Vote now.
President Donal...:,9/29/20,0:16:48,0:00:01,Are you going to pack the court?
Vice President ...:,9/29/20,0:16:49,0:00:03,"Make sure you, in fact, let people know, your Senators."
President Donal...:,9/29/20,0:16:52,0:00:05,He doesn't want to answer the question.
Vice President ...:,9/29/20,0:16:57,0:00:01,I'm not going to answer the question.
President Donal...:,9/29/20,0:16:58,0:00:00,Why wouldn't you answer that question? You want to put a lot of new Supreme Court Justices. Radical left.
Vice President ...:,9/29/20,0:16:58,0:00:02,"Will you shut up, man?"
President Donal...:,9/29/20,0:17:00,0:00:03,"Listen, who is on your list, Joe? Who's on your list?"
Chris Wallace:,9/29/20,0:17:03,0:00:02,"Gentlemen, I think we've ended this-"
Vice President ...:,9/29/20,0:17:05,0:00:00,This is so un-Presidential.
President Donal...:,9/29/20,0:17:05,0:00:02,He's going to pack the court. He is not going to give a list.
Chris Wallace:,9/29/20,0:17:07,0:00:03,We have ended the segment. We're going to move on to the second segment.
Vice President ...:,9/29/20,0:17:10,0:00:05,"That was really a productive segment, wasn't it? Keep yapping, man."
President Donal...:,9/29/20,0:17:15,0:00:02,"The people understand, Joe."
Vice President ...:,9/29/20,0:17:17,0:00:00,They sure do.
President Donal...:,9/29/20,0:17:17,0:00:03,"47 years, you've done nothing. They're understand."
Chris Wallace:,9/29/20,0:17:20,0:00:53,"All right, the second subject is COVID-19, which is an awfully serious subject. So let's try to be serious about it. We have had more than seven million cases of coronavirus in the United States and more than 200,000 people have died. Even after we produce a vaccine, experts say that it could be months or even years before we come back to anything approaching normal. My question for both of you is, based on what you have said and done so far, and what you have said you would do starting in 2021, why should the American people trust you more than your opponent to deal with this public health crisis going forward? In this case, the question goes to you first, sir. Two minutes, uninterrupted."
