speaker,date,start_time,duration,text
Vice President ...:,9/29/20,0:36:03,0:00:17,"Do I get my time back? The fact is that he has in fact, worked on this in a way that he's going to be the first president of the United States to leave office, having fewer jobs in his administration than when he became president. Fewer jobs than when he became president. First one in American history."
Vice President ...:,9/29/20,0:36:20,0:00:45,"Secondly, the people who have lost their jobs are those people who have been on the front lines. Those people who have been saving our lives, those people who have been out there dying. People who've been putting themselves in the way to make sure that we could all try to make it. And the idea that he is insisting that we go forward and open when you have almost half the states in America with a significant increase in COVID deaths and COVID cases in the United States of America, and he wants to open it up more. Why is he want to open it up? Why does he take care of the... You can't fix the economy until you fix the COVID crisis. And he has no intention of doing anything about making it better for you all at home in terms of your health and your safety."
Vice President ...:,9/29/20,0:37:05,0:00:29,"Schools. Why aren't schools open? Because it costs a lot of money to open them safely. They were going to give, his administration going to give the teachers and school students masks, and then they decided no, couldn't do that because it's not a national emergency. Not a national emergency. They've done nothing to help small businesses. Nothing. They're closing. One in six is now gone. He ought to get on the job and take care of the needs of the American people so we can open safely."
Chris Wallace:,9/29/20,0:37:34,0:00:02,"All right. Your time is up, sir. We are going to get to-"
President Donal...:,9/29/20,0:37:36,0:00:01,I have to respond to that.
Chris Wallace:,9/29/20,0:37:37,0:00:02,"Well, you both had two minutes, sir."
President Donal...:,9/29/20,0:37:39,0:00:02,"Excuse me, he made a statement."
Chris Wallace:,9/29/20,0:37:41,0:00:02,And so did you.
President Donal...:,9/29/20,0:37:43,0:00:16,"No, people want their schools open. They don't want to be shut down. They don't want their state shut down. They want their restaurants. I look at New York. It's so sad what's happening in New York. It's almost like a ghost town, and I'm not sure it can ever recover what they've done to New York. People want their places open. They want to get back to their lives."
Vice President ...:,9/29/20,0:37:59,0:00:01,People want to be safe.
President Donal...:,9/29/20,0:38:00,0:00:02,"They'll be careful, but they want their schools open."
Vice President ...:,9/29/20,0:38:02,0:00:01,People want to be safe.
President Donal...:,9/29/20,0:38:03,0:00:07,"I'm the one that brought back football. By the way, I brought back Big Ten football. It was me and I'm very happy to do it-"
Chris Wallace:,9/29/20,0:38:10,0:00:01,All right. Let's-
President Donal...:,9/29/20,0:38:11,0:00:05,... and people of Ohio are very proud of me. And you know how I found out? When [crosstalk 00:14:35].
Chris Wallace:,9/29/20,0:38:16,0:00:32,"Gentlemen, we're going to get to your economic plans going forward in a moment, but first, Mr. President, as you well know, there's a new report that in 2016, the year you were elected president, and 2017, your first year as president, that you paid $750 a year in federal income tax each of those years. I know that you pay a lot of other taxes, but I'm asking you this specific question. Is it true that you paid $750 in federal income taxes each of those two years?"
President Donal...:,9/29/20,0:38:48,0:00:08,"I paid millions of dollars in taxes, millions of dollars of income tax. And let me just tell you, there was a story in one of the papers that paid-"
Vice President ...:,9/29/20,0:38:56,0:00:01,Show us your tax returns.
President Donal...:,9/29/20,0:38:57,0:00:07,"I paid $38 million one year, I paid $27 million one year."
Vice President ...:,9/29/20,0:39:04,0:00:00,Show us your tax returns.
President Donal...:,9/29/20,0:39:04,0:00:18,"You'll see it as soon as it's finished, you'll see it. You know, if you wanted to, go to the Board of Elections. There's 118 page or so report that says everything I have, every bank I have, I'm totally under leveraged because the assets are extremely good, and I built a great company."
Chris Wallace:,9/29/20,0:39:22,0:00:01,"Sir, I'm asking you a specific question, which is-"
President Donal...:,9/29/20,0:39:23,0:00:00,But let me tell you-
Chris Wallace:,9/29/20,0:39:23,0:00:01,I understand all of that.
Vice President ...:,9/29/20,0:39:24,0:00:01,Release your tax return.
Chris Wallace:,9/29/20,0:39:25,0:00:00,I understand all of that-
President Donal...:,9/29/20,0:39:25,0:00:02,Let me-
Chris Wallace:,9/29/20,0:39:27,0:00:09,"No, Mr. President, I'm asking you a question. Will you tell us how much you paid in federal income taxes in 2016 and 2017?"
President Donal...:,9/29/20,0:39:36,0:00:02,Millions of dollars.
Chris Wallace:,9/29/20,0:39:38,0:00:01,You paid millions of dollars in-
President Donal...:,9/29/20,0:39:39,0:00:00,"Millions of dollars, yes."
Chris Wallace:,9/29/20,0:39:39,0:00:01,So not 750?
President Donal...:,9/29/20,0:39:40,0:00:03,Millions of dollars. And you'll get to see it. And you'll get to see it.
Vice President ...:,9/29/20,0:39:43,0:00:01,When?
President Donal...:,9/29/20,0:39:44,0:00:01,But let me just tell you-
Vice President ...:,9/29/20,0:39:45,0:00:00,In [crosstalk 00:16:04]?
President Donal...:,9/29/20,0:39:45,0:00:35,"Chris, let me just say something, that it was the tax laws. I don't want to pay tax. Before I came here, I was a private developer, I was a private business people. Like every other private person, unless they're stupid, they go through the laws, and that's what it is. He passed a tax bill that gave us all these privileges for depreciation and for tax credits. We build the building and we get tax credits, like the hotel on Pennsylvania Avenue. Which by the way, was given to me by the Obama administration, if you can believe that. Now the man got fired right after that happened, but that's-"
Chris Wallace:,9/29/20,0:40:20,0:00:02,"Vice President Biden, you want to respond?"
Vice President ...:,9/29/20,0:40:22,0:00:24,"Yeah, I do want to respond. Look, the tax code that put him in a position that he pays less tax than on the money a school teacher makes is because of him... He says he's smart because he can take advantage of the tax code. And he does take advantage of the tax code. That's why I'm going to eliminate the Trump tax cuts. And I'm going to eliminate those tax cuts."
President Donal...:,9/29/20,0:40:46,0:00:01,That's okay.
Vice President ...:,9/29/20,0:40:47,0:00:06,And make sure that we invest in the people who in fact need the help. People out there need help.
President Donal...:,9/29/20,0:40:53,0:00:03,But why didn't you do it over the last 25 years?
Vice President ...:,9/29/20,0:40:56,0:00:02,Because you weren't president-
President Donal...:,9/29/20,0:40:58,0:00:01,Why didn't you do it over the last 25 years?
Vice President ...:,9/29/20,0:40:59,0:00:01,Because you weren't president and screwing things up.
President Donal...:,9/29/20,0:41:00,0:00:01,You were a Senator and [crosstalk 00:17:21]-
Vice President ...:,9/29/20,0:41:01,0:00:03,You're the worst president America has ever had. Come on.
President Donal...:,9/29/20,0:41:04,0:00:09,"Hey, Joe, let me just tell you, Joe. In 47 months, I've done more than you've done in 47 years, Joe. We've done things that you never even thought of doing."
Chris Wallace:,9/29/20,0:41:13,0:00:00,Okay. Gentlemen?
President Donal...:,9/29/20,0:41:13,0:00:05,"Including fixing the broken military that you gave me, including taking care of your debts."
Chris Wallace:,9/29/20,0:41:18,0:00:08,"Mr. President, we're talking about the economy. I'd like to ask you about your plans going forward because Mr. Vice President, your economic plan-"
President Donal...:,9/29/20,0:41:26,0:00:01,He has none.
Chris Wallace:,9/29/20,0:41:27,0:00:16,"... if you were to be elected president focuses a lot on big government, big taxes, big spending. I want to focus first on the taxes. You propose more than $4 trillion over a decade in new taxes on individuals making more than $400,000 a year."
Chris Wallace:,9/29/20,0:41:43,0:00:10,"... on individuals making more than $400,000 a year and on corporations. President Trump says that that kind of an increase in taxes is going to hurt the economy as it's just coming out of a recession."
Vice President ...:,9/29/20,0:41:53,0:00:37,"Well, just take a look at what is the analysis done by Wall Street firms, points out that my economic plan would create 7 million more jobs than his in four years, number one. And number two, it would create an additional $1 trillion in economic growth, because it would be about buying American. The federal government spends $600 billion a year on everything from ships, to steel, to buildings and the like. And under my proposal, we're going to make sure that every penny of that has to be made by a company-"
Chris Wallace:,9/29/20,0:42:30,0:00:03,"But respectfully, sir, I'm talking about taxes, not spending."
Vice President ...:,9/29/20,0:42:33,0:00:16,"By the way, I'm going to eliminate a significant number of the taxes. I'm going to make the corporate tax 28%. It shouldn't be 21%. You have 91 companies federal, I mean, the fortune 500, who don't pay a single penny in tax making billions of dollars."
President Donal...:,9/29/20,0:42:49,0:00:03,"Why didn't you do it before, when you were vice president with Obama?"
Vice President ...:,9/29/20,0:42:52,0:00:04,"Because you in fact passed that, that was your tax proposal."
President Donal...:,9/29/20,0:42:56,0:00:01,I got it done. And you know what happened?
Vice President ...:,9/29/20,0:42:57,0:00:01,"Yeah, you got it done-"
President Donal...:,9/29/20,0:42:58,0:00:02,Our economy boomed like it's never boomed before.
Vice President ...:,9/29/20,0:43:00,0:00:00,The economy-
Chris Wallace:,9/29/20,0:43:00,0:00:02,Mr. President-
Vice President ...:,9/29/20,0:43:02,0:00:01,Let me finish.
Chris Wallace:,9/29/20,0:43:03,0:00:08,"Mr. President, let me pick up on that. You would continue your free market approach, lower taxes, more deregulation, correct?"
Vice President ...:,9/29/20,0:43:11,0:00:03,Not lower tax for the American people.
Chris Wallace:,9/29/20,0:43:14,0:00:00,But let me-
President Donal...:,9/29/20,0:43:14,0:00:00,Excuse me.
Chris Wallace:,9/29/20,0:43:14,0:00:13,"You talk about the economy booming. It turns out that in Obama's final three years as president more jobs were created, a million and a half more jobs, than in the first three years of your presidency."
President Donal...:,9/29/20,0:43:27,0:00:42,"They had the slowest economic recovery since 1929. It was the slowest recovery. Also, they took over something that was down here. All you had to do is turn on the lights and you pick up a lot. But they had the slowest economic recovery since 1929, and let me tell you about the stock market. When the stock market goes up, that means jobs. It also means 401ks. If you got in, if you ever became president with your ideas, you want to terminate my taxes. I'll tell you what, you'll lose. Half of the companies that have poured in here will leave. And plenty of companies that are already here, they'll leave for other places. [crosstalk 00:20:25] They will leave and you will have a depression, the likes of which you've never seen."
Vice President ...:,9/29/20,0:44:09,0:00:00,Look-
Chris Wallace:,9/29/20,0:44:09,0:00:01,Mr. Vice President.
Vice President ...:,9/29/20,0:44:10,0:00:14,"... we inherited the worst recession, short of a depression in American history. I was asked to bring it back. We were able to have an economic recovery that created the jobs you're talking about. We handed him a booming economy, he blew it."
President Donal...:,9/29/20,0:44:24,0:00:01,It wasn't blooming.
Vice President ...:,9/29/20,0:44:25,0:00:01,He blew it.
President Donal...:,9/29/20,0:44:26,0:00:04,He was in booming. It was the weakest recovery since 1929.
Chris Wallace:,9/29/20,0:44:30,0:00:03,"Wait, wait, is it fair to say he blew it when, in fact-"
President Donal...:,9/29/20,0:44:33,0:00:01,When COVID came along.
Chris Wallace:,9/29/20,0:44:34,0:00:03,... when there was record low unemployment before COVID.
Vice President ...:,9/29/20,0:44:37,0:00:07,"Yeah, because what he did, even before COVID, manufacturing went in the hole. Manufacturing went in a hole-"
President Donal...:,9/29/20,0:44:44,0:00:01,"Excuse me, Chris, wait."
Vice President ...:,9/29/20,0:44:45,0:00:01,... number one. Number two-
President Donal...:,9/29/20,0:44:46,0:00:00,Chris.
Vice President ...:,9/29/20,0:44:46,0:00:01,Number three.
President Donal...:,9/29/20,0:44:47,0:00:02,"They said it would take... No, you're on number two."
Vice President ...:,9/29/20,0:44:49,0:00:01,No.
President Donal...:,9/29/20,0:44:50,0:00:02,"Chris, Chris. They said it would take-"
Vice President ...:,9/29/20,0:44:52,0:00:00,This guy-
President Donal...:,9/29/20,0:44:52,0:00:08,"... a miracle to bring back manufacturing. I brought back 700,000 jobs. They brought back nothing. They gave up on manufacturing."
Vice President ...:,9/29/20,0:45:00,0:00:01,We did not. [crosstalk 00:21:21]
President Donal...:,9/29/20,0:45:01,0:00:01,... standard fare.
Vice President ...:,9/29/20,0:45:02,0:00:03,I'm the guy that brought back the automobile industry.
President Donal...:,9/29/20,0:45:05,0:00:00,He totally gave up on manufacturing.
Chris Wallace:,9/29/20,0:45:05,0:00:00,"All right, let him-"
Vice President ...:,9/29/20,0:45:05,0:00:09,"I was asked to bring back Chrysler and General Motors. He brought them back right here in the state of Ohio and Michigan. He blew it. They're gone. He blew it. And in fact, they're gone-"
President Donal...:,9/29/20,0:45:14,0:00:06,Ohio had the best year it's ever had last year. Michigan had the best year they've ever had.
Vice President ...:,9/29/20,0:45:20,0:00:01,That is not true.
President Donal...:,9/29/20,0:45:21,0:00:06,"Many car companies came in from Germany, from Japan, went to Michigan, went to Ohio and they didn't come in with you. [crosstalk 00:21:47]."
Chris Wallace:,9/29/20,0:45:27,0:00:01,"Mr. Vice President, go ahead."
Vice President ...:,9/29/20,0:45:28,0:00:18,And so you take a look at what he's actually done. He's done very little. His trade deals are the same way. He talks about these great trade deals. He talks about the art of the deal. China's perfected the art of the steel. We have a higher deficit with China now than we did before. We have the highest trade deficit-
President Donal...:,9/29/20,0:45:46,0:00:02,China ate your lunch- [crosstalk 00:00:22:07].
Vice President ...:,9/29/20,0:45:48,0:00:01,... with Mexico.
President Donal...:,9/29/20,0:45:49,0:00:19,"China ate your lunch, Joe. And no wonder your son goes in and he takes out billions of dollars. He takes out billions of dollars to manage. He makes millions of dollars. And also, while we're at it, why is it just out of curiosity, the mayor of Moscow's wife gave you a son three and a half million dollars?"
Vice President ...:,9/29/20,0:46:08,0:00:00,That is not true.
President Donal...:,9/29/20,0:46:08,0:00:03,What did he do to deserve it? What did he do with-
Vice President ...:,9/29/20,0:46:11,0:00:00,None of that is true.
President Donal...:,9/29/20,0:46:11,0:00:00,"... to deserve $183,000?"
Chris Wallace:,9/29/20,0:46:11,0:00:06,"Sir, you've asked him a question, let him answer it."
Vice President ...:,9/29/20,0:46:17,0:00:01,None of that is true.
President Donal...:,9/29/20,0:46:18,0:00:01,"Oh really, he didn't get three and a half million?"
Chris Wallace:,9/29/20,0:46:19,0:00:01,Mr. President-
Vice President ...:,9/29/20,0:46:20,0:00:01,Is totally-
Chris Wallace:,9/29/20,0:46:21,0:00:00,"Mr. President, please. You've asked a question- [crosstalk 00:22:41]"
Vice President ...:,9/29/20,0:46:21,0:00:04,Totally discredited. Totally discredited. And by the way-
President Donal...:,9/29/20,0:46:25,0:00:03,"Well wait, he didn't get three and a half million dollars, Joe?"
Vice President ...:,9/29/20,0:46:28,0:00:00,Mr. Vice-
President Donal...:,9/29/20,0:46:28,0:00:01,He got three and a half million-
Chris Wallace:,9/29/20,0:46:29,0:00:00,Mr. President.
President Donal...:,9/29/20,0:46:29,0:00:01,... dollars.
Vice President ...:,9/29/20,0:46:30,0:00:01,That is not true.
President Donal...:,9/29/20,0:46:31,0:00:00,"Oh, really?"
Chris Wallace:,9/29/20,0:46:31,0:00:05,"Mr. President, it's an open discussion. Please- [crosstalk 00:22:56]"
President Donal...:,9/29/20,0:46:36,0:00:01,It's a fact.
Vice President ...:,9/29/20,0:46:37,0:00:00,It is not a fact.
Chris Wallace:,9/29/20,0:46:37,0:00:03,"Well, you have raised an issue, let the Vice President answer."
Vice President ...:,9/29/20,0:46:40,0:00:01,It's been totally discredited.
President Donal...:,9/29/20,0:46:41,0:00:05,"Did Burisma pay him 183,000 a month, with no experience in energy?"
Chris Wallace:,9/29/20,0:46:46,0:00:01,Mr. President-
Vice President ...:,9/29/20,0:46:47,0:00:03,My son did nothing wrong at Barisma-
President Donal...:,9/29/20,0:46:50,0:00:00,I think he did.
Chris Wallace:,9/29/20,0:46:50,0:00:01,"Mr. President, let him answer. [crosstalk 00:23:13]."
Vice President ...:,9/29/20,0:46:51,0:00:09,"He doesn't want to let me answer, because he knows I have the truth. His position has been totally thoroughly discredited-"
President Donal...:,9/29/20,0:47:00,0:00:00,By who?
Vice President ...:,9/29/20,0:47:00,0:00:00,And you can-
President Donal...:,9/29/20,0:47:00,0:00:00,The media.
Vice President ...:,9/29/20,0:47:00,0:00:03,"by everybody. Well, by the media, by our allies."
President Donal...:,9/29/20,0:47:03,0:00:00,"By the media, because they refuse to talk about it-"
Vice President ...:,9/29/20,0:47:03,0:00:01,By the World Bank-
President Donal...:,9/29/20,0:47:04,0:00:03,... because they're embarrassed.
Vice President ...:,9/29/20,0:47:07,0:00:03,"By everyone, has discredited. And matter of fact [crosstalk 00:23:30] Matter of fact-"
Chris Wallace:,9/29/20,0:47:10,0:00:01,"Mr. President, please stop."
Vice President ...:,9/29/20,0:47:11,0:00:02,Even the people who testified under oath-
President Donal...:,9/29/20,0:47:13,0:00:03,"So let me ask you this, Joe- [crosstalk 00:23:35]."
Chris Wallace:,9/29/20,0:47:16,0:00:01,"Go ahead, I'm listening to you."
Vice President ...:,9/29/20,0:47:17,0:00:01,Even the people under-
President Donal...:,9/29/20,0:47:18,0:00:02,He got three and a half million dollars from Moscow.
Vice President ...:,9/29/20,0:47:20,0:00:07,... testified under oath in his administration said I did my job and I did it very well.
President Donal...:,9/29/20,0:47:27,0:00:00,"Oh, really?"
Vice President ...:,9/29/20,0:47:27,0:00:00,I did it honorably.
President Donal...:,9/29/20,0:47:27,0:00:01,I'd like to know who they are.
Vice President ...:,9/29/20,0:47:28,0:00:02,"Well, I'll give you the list of the people who-"
President Donal...:,9/29/20,0:47:30,0:00:00,I'll fire them.
Chris Wallace:,9/29/20,0:47:30,0:00:01,"No, no. Go ahead, sir."
Vice President ...:,9/29/20,0:47:31,0:00:03,"I'm sure that you've already fired most of them, because they did a good job."
President Donal...:,9/29/20,0:47:34,0:00:01,Some people don't do a good job.
Vice President ...:,9/29/20,0:47:35,0:00:02,"Well, here's the- [crosstalk 00:23:57]"
Chris Wallace:,9/29/20,0:47:37,0:00:02,"Go ahead. You get the- [crosstalk 00:23:57] Wait a minute. You get the final word, Mr.-"
Vice President ...:,9/29/20,0:47:39,0:00:03,"Well, it's hard to get any word in with this clown. Excuse me, this person."
President Donal...:,9/29/20,0:47:42,0:00:01,"Hey, let me just tell you, Joe-"
Vice President ...:,9/29/20,0:47:43,0:00:01,"No, no. Mr. President- [crosstalk 00:24:05]"
President Donal...:,9/29/20,0:47:44,0:00:02,"Three and a half million, Joe."
Vice President ...:,9/29/20,0:47:46,0:00:01,That is simply not true.
President Donal...:,9/29/20,0:47:47,0:00:02,Why did he deserve three and a half million from Moscow?
Vice President ...:,9/29/20,0:47:49,0:00:10,"Look, here's the deal. We want to talk about families and ethics. I don't want to do that. I mean, his family, we could talk about all night. His family's already-"
President Donal...:,9/29/20,0:47:59,0:00:01,My family-
Chris Wallace:,9/29/20,0:48:00,0:00:00,"No, no- [crosstalk 00:06:20]."
President Donal...:,9/29/20,0:48:00,0:00:04,My family lost a fortune by coming down and helping us with governance.
Vice President ...:,9/29/20,0:48:04,0:00:01,And that's such a- [crosstalk 00:24:25]
Chris Wallace:,9/29/20,0:48:05,0:00:01,Mr. President-
President Donal...:,9/29/20,0:48:06,0:00:01,Every single one of them lost a fortune-
Vice President ...:,9/29/20,0:48:07,0:00:16,"This is not about my family or his family. It's about your family, the American people. [crosstalk 00:24:32] That's not true. It doesn't want to talk about what you need. You, the American people, it's about you. That's what we're talking about here. [crosstalk 00:24:42]"
Chris Wallace:,9/29/20,0:48:23,0:00:03,That's the end of the segment. We're moving on.
Vice President ...:,9/29/20,0:48:26,0:00:01,He didn't take that.
Chris Wallace:,9/29/20,0:48:27,0:00:00,Vice President-
President Donal...:,9/29/20,0:48:27,0:00:02,"Chris, can I be honest? It's a very important question-"
Vice President ...:,9/29/20,0:48:29,0:00:01,Try to be honest.
Chris Wallace:,9/29/20,0:48:30,0:00:00,No.
President Donal...:,9/29/20,0:48:30,0:00:02,He stood up-
Chris Wallace:,9/29/20,0:48:32,0:00:01,The answer to the question is no.
President Donal...:,9/29/20,0:48:33,0:00:02,... and the threatened Ukraine-
Chris Wallace:,9/29/20,0:48:35,0:00:00,Sir-
President Donal...:,9/29/20,0:48:35,0:00:02,... with a billion dollars-
Vice President ...:,9/29/20,0:48:37,0:00:04,That is absolutely not true.
Chris Wallace:,9/29/20,0:48:41,0:00:08,"Stop. [crosstalk 00:25:02] Gentlemen, I hate to raise my voice, but I- [crosstalk 00:25:05] Why should I be different than the two of you? So here's the deal."
Vice President ...:,9/29/20,0:48:49,0:00:00,That's a good point.
Chris Wallace:,9/29/20,0:48:49,0:00:28,"We have six segments. We have ended that segment. We're going to go to the next segment. In that segment, you each are going to have two uninterrupted moments. In those two interrupted minutes, Mr. President, you can say anything you want. I'm going to ask a question about race, but if you want to answer about something else, go ahead. But I think that the country would be better served, if we allowed both people to speak with fewer interruptions. I'm appealing to you, sir, to do that."
President Donal...:,9/29/20,0:49:17,0:00:01,"Well, and him too."
Chris Wallace:,9/29/20,0:49:18,0:00:02,"Well, frankly, you've been doing more interrupting than he has."
President Donal...:,9/29/20,0:49:20,0:00:01,"Well, that's all right, but he does plenty."
Chris Wallace:,9/29/20,0:49:21,0:00:02,"Well, sir, less than-"
President Donal...:,9/29/20,0:49:23,0:00:00,He does plenty.
Chris Wallace:,9/29/20,0:49:23,0:00:22,"No, less than you have. Let's please continue on. The issue of rice. Vice-President Biden, you say that President Trump's response to the violence in Charlottesville three years ago, when he talked about very fine people on both sides, was what directly led you to launch this run for president."
President Donal...:,9/29/20,0:49:45,0:00:01,"Oh yeah, sure."
Chris Wallace:,9/29/20,0:49:46,0:00:10,"President Trump, you have often said that you believe you will have done more for Black Americans than any president with the possible exception of Abraham Lincoln."
President Donal...:,9/29/20,0:49:56,0:00:00,That's true.
Chris Wallace:,9/29/20,0:49:56,0:00:13,"My question for the two of you, is why should voters trust you rather than your opponent to deal with the race issues facing this country over the next four years? Vice President Biden, you go first."
Vice President ...:,9/29/20,0:50:09,0:00:42,"It's about equity and equality. It's about decency. It's about the constitution. And we have never walked away from trying to require equity for everyone, equality for the whole of America. But we've never accomplished it, but we've never walked away from it like he has done. It is true, the reason I got in the race is when those people... Close your eyes, remember what those people look like coming out of the fields, carrying torches, their veins bulging, just spewing anti-Semitic bile and accompanied by the Ku Klux Klan. A young woman got killed and they asked the president what he thought. He said, ""There were very fine people on both sides."" No president's ever said anything like that. [crosstalk 00:27:10]."
Chris Wallace:,9/29/20,0:50:51,0:00:01,It is his-
Vice President ...:,9/29/20,0:50:52,0:00:00,Now-
Chris Wallace:,9/29/20,0:50:52,0:00:01,... minute sir.
Vice President ...:,9/29/20,0:50:53,0:00:37,"... second point I'd make to you, is that when Floyd was killed, when Mr. Floyd was killed, there was a peaceful protest in front of the White House. What did he do? He came out of his bunker, had the military use tear gas on them so he could walk across to a church and hold up a Bible. And then what happened after that? The Bishop of that very church said that it was a disgrace. The general who was with him said all he ever wants to do is divide people, not unite people at all. This is a president who has used everything as a dog whistle, to try to generate racists hatred, racist division."
